Difficulty,Question,Answer
Easy,"What is the process by which plants make their own food using sunlight?","Photosynthesis is the process by which plants convert sunlight, carbon dioxide, and water into glucose and oxygen using chlorophyll in their leaves."
Easy,"Name the three states of matter.","The three states of matter are solid, liquid, and gas. Each state has different properties based on how tightly packed the molecules are."
Easy,"Which planet is closest to the Sun?","Mercury is the planet closest to the Sun in our solar system, orbiting at an average distance of about 36 million miles."
Easy,"What do we call animals that eat only plants?","Herbivores are animals that eat only plants. Examples include rabbits, deer, and cows, which have specialized digestive systems to break down plant material."
Easy,"Which part of the plant absorbs water from the soil?","Roots absorb water and nutrients from the soil. They have tiny root hairs that increase surface area for better absorption and anchor the plant in place."
Easy,"What is the path Earth takes around the Sun called?","Earth's path around the Sun is called an orbit. It takes Earth approximately 365.25 days to complete one full orbit, which we call a year."
Easy,"What gas do we breathe in that our body needs?","We breathe in oxygen, which our body needs for cellular respiration to produce energy from food. Oxygen is essential for all cellular processes that keep us alive."
Easy,"What happens to most of the water that falls as rain?","Most rainwater either soaks into the ground (infiltration) or flows into streams and rivers (runoff), eventually returning to oceans where it can evaporate and continue the water cycle."
Easy,"What do plants need to grow?","Plants need sunlight, water, carbon dioxide, nutrients from soil, and appropriate temperature to grow. These elements are essential for photosynthesis and other life processes."
Easy,"What causes wind?","Wind is caused by uneven heating of Earth's surface by the Sun. Warm air rises and cool air moves in to replace it, creating air movement we feel as wind."
Easy,"What is the center of our solar system?","The Sun is the center of our solar system. It's a star that provides light and heat energy to Earth and other planets through nuclear fusion reactions."
Easy,"What is the biggest planet in our solar system?","Jupiter is the largest planet in our solar system. It's a gas giant with a mass greater than all other planets combined and has many moons including the four largest discovered by Galileo."
Easy,"What do we call animals that eat both plants and meat?","Omnivores are animals that eat both plants and meat. Examples include humans, bears, and pigs, which have digestive systems adapted to process both types of food."
Easy,"What is the hardest natural substance on Earth?","Diamond is the hardest natural substance on Earth. It forms deep underground under extreme pressure and heat, creating its extremely strong crystal structure."
Easy,"Which gas do plants take in during photosynthesis?","Plants take in carbon dioxide during photosynthesis. They absorb it from the air through tiny pores called stomata in their leaves."
Easy,"What is the smallest planet in our solar system?","Mercury is the smallest planet in our solar system. It's only slightly larger than Earth's Moon and has extreme temperature variations."
Easy,"What do we call the layer of gases surrounding Earth?","The atmosphere is the layer of gases surrounding Earth. It contains the air we breathe and protects us from harmful radiation from space."
Easy,"What is the main source of energy for Earth?","The Sun is the main source of energy for Earth. It provides light and heat that drives weather patterns, ocean currents, and supports all life."
Easy,"What do we call water that falls from clouds?","Precipitation is water that falls from clouds. It can be in the form of rain, snow, sleet, or hail depending on temperature conditions."
Easy,"What part of the flower attracts insects?","Petals attract insects to flowers. They are often brightly colored and may have sweet scents to draw pollinators like bees and butterflies."
Easy,"What is the force that pulls objects toward Earth?","Gravity is the force that pulls objects toward Earth. It keeps us on the ground and causes objects to fall when dropped."
Easy,"What do we call animals that hunt other animals for food?","Predators are animals that hunt other animals for food. Examples include lions, hawks, and sharks that actively pursue and capture prey."
Easy,"What is the basic building block of all living things?","Cells are the basic building blocks of all living things. Every organism is made up of one or more cells that carry out life processes."
Easy,"What gas do animals breathe out?","Animals breathe out carbon dioxide. This waste gas is produced when cells use oxygen to break down food for energy."
Easy,"What is the hottest planet in our solar system?","Venus is the hottest planet in our solar system. Its thick atmosphere traps heat, making surface temperatures hotter than Mercury despite being farther from the Sun."
Easy,"What do we call young plants that grow from seeds?","Seedlings are young plants that grow from seeds. They develop their first leaves and roots as they begin independent growth."
Easy,"What is the imaginary line around the middle of Earth called?","The equator is the imaginary line around the middle of Earth. It divides the planet into Northern and Southern hemispheres."
Easy,"What do we call the process when water changes from liquid to gas?","Evaporation is the process when water changes from liquid to gas. Heat energy causes water molecules to move faster and escape into the air as water vapor."
Easy,"What is the closest star to Earth?","The Sun is the closest star to Earth. It's about 93 million miles away and provides the light and heat necessary for life on our planet."
Easy,"What do we call animals that are hunted by predators?","Prey are animals that are hunted by predators. They often have adaptations like speed, camouflage, or warning colors to help them avoid being caught."
Easy,"What is the process when water vapor changes back to liquid?","Condensation is the process when water vapor changes back to liquid. This happens when warm, moist air cools down, forming water droplets."
Easy,"What do we call the seasonal movement of animals from one place to another?","Migration is the seasonal movement of animals from one place to another. Animals migrate to find food, suitable climate, or breeding grounds."
Easy,"What is the layer of Earth we live on called?","The crust is the layer of Earth we live on. It's the thin, solid outer layer that includes continents and ocean floors."
Easy,"What do we call a group of the same type of animals living together?","A population is a group of the same type of animals living together in the same area. For example, all the deer in a forest form a deer population."
Medium,"Explain why objects fall to the ground when dropped.","Objects fall to the ground due to gravity, which is the force of attraction between Earth and any object near its surface. Gravity pulls objects toward Earth's center."
Medium,"What is the difference between a renewable and non-renewable resource?","Renewable resources can be replenished naturally over time (like solar energy, wind), while non-renewable resources are finite and cannot be easily replaced once used (like oil, coal)."
Medium,"How do clouds form in the sky?","Clouds form when water vapor in the air cools and condenses around tiny particles like dust or pollen, creating water droplets that cluster together in the atmosphere."
Medium,"Why do we see lightning before hearing thunder?","We see lightning before hearing thunder because light travels much faster than sound. Light travels at about 186,000 miles per second, while sound travels at about 1,100 feet per second."
Medium,"What happens to water when it freezes?","When water freezes, it changes from liquid to solid state (ice), its molecules slow down and arrange in a rigid structure, and it expands slightly, which is why ice floats on water."
Medium,"Why do leaves change color in fall?","Leaves change color in fall because chlorophyll breaks down, revealing other pigments like carotenoids (yellow/orange) and anthocyanins (red/purple) that were masked by the green chlorophyll during summer."
Medium,"Why do objects appear smaller when they are far away?","Objects appear smaller when far away due to perspective. The angle of light rays reaching our eyes becomes smaller as distance increases, making distant objects occupy less of our visual field."
Medium,"Why do we have day and night?","Day and night occur because Earth rotates on its axis once every 24 hours. As Earth spins, different parts face the Sun (day) while other parts face away from the Sun (night)."
Medium,"Why does metal feel colder than wood at the same temperature?","Metal feels colder than wood because it conducts heat better. Metal quickly draws heat away from your skin, while wood is a poor conductor and doesn't remove heat as rapidly."
Medium,"Why do we see different phases of the Moon?","Moon phases occur because we see different portions of the Moon's illuminated side as it orbits Earth. The changing angle between Earth, Moon, and Sun creates the cycle from new moon to full moon."
Medium,"Why do some materials conduct electricity while others don't?","Materials conduct electricity based on how easily electrons can move through them. Metals have free electrons that move easily (conductors), while materials like rubber hold electrons tightly (insulators)."
Medium,"Why do some objects float while others sink?","Objects float or sink based on density compared to the fluid they're in. If an object is less dense than water, it floats; if more dense, it sinks. Shape also affects buoyancy."
Medium,"How do shadows form?","Shadows form when an object blocks light from reaching a surface. The area behind the object receives less light, creating a darker region called a shadow."
Medium,"Why do magnets attract certain metals?","Magnets attract certain metals because these materials (iron, nickel, cobalt) have magnetic properties. The magnetic field of the magnet aligns the magnetic domains in these metals, creating attraction."
Medium,"How do plants get energy from sunlight?","Plants get energy from sunlight through photosynthesis. Chlorophyll in leaves captures light energy and uses it to convert carbon dioxide and water into glucose, which stores chemical energy."
Medium,"Why do ice cubes melt faster in warm water than cold water?","Ice cubes melt faster in warm water because heat transfers from the warmer water to the colder ice. The greater temperature difference causes faster melting."
Medium,"How do birds know which direction to migrate?","Birds use various navigation methods for migration including the Sun's position, Earth's magnetic field, star patterns, and geographical landmarks to find their way."
Medium,"Why do earthquakes happen?","Earthquakes happen when tectonic plates move and create pressure along fault lines. When this pressure becomes too great, rocks break suddenly, releasing energy as seismic waves."
Medium,"How do animals survive winter in cold climates?","Animals survive winter through adaptations like thick fur, hibernation, migration to warmer areas, or storing fat for energy during times when food is scarce."
Medium,"Why do deserts get very hot during the day and cold at night?","Deserts have extreme temperature changes because dry air and sparse vegetation don't retain heat well. During the day, the Sun heats the ground intensely, but at night, heat escapes quickly into the atmosphere."
Medium,"How do fish breathe underwater?","Fish breathe underwater using gills that extract oxygen dissolved in water. Water flows over the gills, and oxygen passes into the fish's bloodstream while carbon dioxide is removed."
Medium,"Why do some plants grow toward light?","Plants grow toward light through phototropism. Light-detecting cells trigger the production of growth hormones that cause stems to bend toward the light source for better photosynthesis."
Medium,"How do bees help plants reproduce?","Bees help plants reproduce by pollination. When bees collect nectar, pollen sticks to their bodies and transfers to other flowers, allowing plants to fertilize and produce seeds."
Medium,"Why do volcanoes erupt?","Volcanoes erupt when pressure builds up from molten rock (magma) beneath Earth's surface. The magma rises through cracks in the crust and explodes outward as lava, gas, and ash."
Medium,"How do animals use camouflage for protection?","Animals use camouflage by having colors, patterns, or shapes that help them blend into their environment, making it harder for predators to spot them or for them to be seen while hunting."
Medium,"Why do some seeds have wings or fluffy parts?","Some seeds have wings or fluffy parts to help with dispersal. These adaptations allow seeds to be carried by wind to new locations where they can grow without competing with the parent plant."
Medium,"How do nocturnal animals see in the dark?","Nocturnal animals have special adaptations like larger eyes, more light-sensitive cells, or reflective layers behind their retinas that help them see better in low-light conditions."
Hard,"Describe the water cycle and name its four main stages.","The water cycle consists of evaporation (water changes to vapor), condensation (vapor forms clouds), precipitation (rain/snow falls), and collection (water gathers in bodies of water). This cycle continuously moves water through Earth's systems."
Hard,"Explain how sound travels from its source to your ears.","Sound travels as vibrations through matter. When an object vibrates, it creates sound waves that move through air molecules. These waves reach your ears, causing your eardrums to vibrate, which your brain interprets as sound."
Hard,"Explain how magnets work and what materials they attract.","Magnets work due to magnetic fields created by moving electrons. They attract ferromagnetic materials like iron, nickel, and cobalt. Magnets have north and south poles, and opposite poles attract while like poles repel."
Hard,"Explain how earthquakes occur.","Earthquakes occur when tectonic plates in Earth's crust move and create stress along fault lines. When this stress exceeds the strength of rocks, they break suddenly, releasing energy as seismic waves that shake the ground."
Hard,"Explain how a rainbow forms.","Rainbows form when sunlight passes through water droplets in the air. The water acts like tiny prisms, separating white light into its component colors (red, orange, yellow, green, blue, indigo, violet) through refraction and reflection."
Hard,"Explain how erosion shapes Earth's surface.","Erosion is the wearing away and transport of rock and soil by water, wind, ice, and gravity. Over time, erosion creates valleys, canyons, and coastlines while depositing sediment in new locations, continuously reshaping Earth's surface."
Hard,"Explain how the Moon affects Earth's tides.","The Moon's gravity pulls on Earth's oceans, creating bulges of water on the side facing the Moon and the opposite side. As Earth rotates through these bulges, coastal areas experience high and low tides approximately twice daily."
Hard,"Explain how volcanoes form and erupt.","Volcanoes form where magma from Earth's mantle reaches the surface through cracks in the crust. Eruptions occur when pressure builds up underground, forcing magma, gas, and ash upward through volcanic vents."
Hard,"Explain how fossil fuels formed.","Fossil fuels formed millions of years ago from dead plants and animals buried under layers of sediment. Heat and pressure over geological time converted this organic matter into coal, oil, and natural gas."
Hard,"Describe how different types of rocks form.","Igneous rocks form from cooling magma or lava. Sedimentary rocks form from compressed and cemented particles of other rocks, minerals, or organic matter. Metamorphic rocks form when existing rocks are changed by heat and pressure."
Hard,"Explain how the greenhouse effect works.","The greenhouse effect occurs when certain gases in the atmosphere trap heat from the Sun. These gases allow sunlight to enter but prevent some heat from escaping back to space, keeping Earth warm enough for life."
Hard,"Describe how food chains show energy transfer.","Food chains show how energy moves from producers (plants) to primary consumers (herbivores) to secondary consumers (carnivores). Energy decreases at each level because organisms use energy for life processes and lose some as heat."
Hard,"Explain how weathering breaks down rocks.","Weathering breaks down rocks through physical processes (like freezing and thawing, root growth) and chemical processes (like acid rain, oxidation). This creates smaller particles that can be transported by erosion."
Hard,"Describe how Earth's layers differ from each other.","Earth has four main layers: the crust (thin, solid outer layer), mantle (hot, dense rock that flows slowly), outer core (liquid iron and nickel), and inner core (solid iron and nickel under extreme pressure)."
Hard,"Explain how animals adapt to their environments over time.","Animals adapt through natural selection, where individuals with helpful traits survive and reproduce more successfully. Over many generations, these beneficial traits become more common in the population."
Hard,"Describe how the solar system formed.","The solar system formed about 4.6 billion years ago from a collapsing cloud of dust and gas. Gravity pulled material toward the center, forming the Sun, while remaining material clumped together to form planets and other objects."
Hard,"Explain how photosynthesis and cellular respiration are related.","Photosynthesis and cellular respiration are opposite processes. Photosynthesis uses carbon dioxide and water to make glucose and oxygen using sunlight. Cellular respiration uses glucose and oxygen to make energy, producing carbon dioxide and water."
Hard,"Describe how mountains form.","Mountains form through tectonic processes: convergent boundaries where plates push together and fold rock layers upward, or where volcanic activity builds up material from below. This process takes millions of years."
Hard,"Explain how fossils provide evidence of past life.","Fossils preserve remains or traces of ancient organisms in rock layers. By studying fossils, scientists can learn about extinct species, how life evolved over time, and what Earth's environments were like in the past."
Hard,"Describe how Earth's magnetic field protects us.","Earth's magnetic field deflects harmful solar radiation and cosmic particles away from our planet. Without this protection, these high-energy particles would strip away our atmosphere and make life impossible."
Hard,"Explain how the carbon cycle connects living and non-living parts of Earth.","The carbon cycle moves carbon between the atmosphere, oceans, land, and living organisms. Plants absorb carbon dioxide, animals eat plants, decomposition returns carbon to soil and air, and geological processes store carbon in rocks."
Hard,"Describe how natural disasters can change Earth's surface quickly.","Natural disasters like earthquakes, volcanic eruptions, landslides, and floods can rapidly change Earth's surface by creating new landforms, destroying existing features, and moving large amounts of material in short periods."
Hard,"Explain how human activities affect natural cycles.","Human activities like burning fossil fuels, deforestation, and agriculture alter natural cycles by changing the amounts of gases in the atmosphere, disrupting water cycles, and affecting nutrient cycles in ecosystems."
Hard,"Describe how energy from the Sun drives weather patterns.","Solar energy heats Earth's surface unevenly, creating temperature and pressure differences. This causes air to move, forming wind patterns, storms, and weather systems that distribute heat and moisture around the planet."
Hard,"Explain how biodiversity helps ecosystems stay healthy.","Biodiversity provides stability to ecosystems because different species perform various roles. If one species is affected by disease or environmental change, other species can maintain ecosystem functions like pollination, decomposition, and food webs."
Hard,"Describe how Earth's rotation affects wind and ocean currents.","Earth's rotation causes the Coriolis effect, which deflects moving air and water. This creates curved patterns in wind systems and ocean currents, influencing weather patterns and climate around the world."
Hard,"Explain how invasive species can disrupt ecosystems.","Invasive species can disrupt ecosystems by competing with native species for resources, preying on species that haven't evolved defenses, or changing habitat conditions. This can lead to population declines or extinctions of native species."
Hard,"Describe how scientists use models to understand Earth's systems.","Scientists use physical, mathematical, and computer models to study complex Earth systems. Models help predict weather, climate change, and natural disasters by simulating how different parts of Earth's systems interact."
Hard,"Explain how conservation efforts help protect endangered species.","Conservation efforts protect endangered species through habitat preservation, breeding programs, laws against hunting, removal of invasive species, and education. These strategies address the main causes of species decline."
Hard,"Describe how technology helps scientists study Earth and space.","Technology like satellites, telescopes, seismographs, and computer simulations allows scientists to observe and measure phenomena that are too distant, too small, or too dangerous to study directly."